{
  "schema_version": 1,
  "name": "linear-pipeline",
  "description": "The simplest possible workflow: a straight three-step chain with no conditions — fetch a page (tool), summarize it (llm), record the result (echo). Demonstrates sequential dependency edges, a required run parameter referenced from step config, and an explicit retry policy on the network-bound step (ADR-006; the other steps inherit engine defaults).",
  "params": {
    "url": {
      "type": "string",
      "required": true
    }
  },
  "steps": [
    {
      "id": "fetch",
      "type": "tool",
      "config": {
        "tool": "http_request",
        "input": {
          "method": "GET",
          "url": "${{ run.params.url }}"
        }
      },
      "retry": {
        "max_attempts": 3,
        "backoff": {
          "initial": "1s",
          "cap": "30s"
        }
      }
    },
    {
      "id": "summarize",
      "type": "llm",
      "config": {
        "model": "anthropic/claude-sonnet-5",
        "prompt": "Summarize the following page in three bullet points:\n\n${{ steps.fetch.output.body }}",
        "max_tokens": 512
      }
    },
    {
      "id": "store",
      "type": "echo",
      "config": {
        "input": {
          "summary": "${{ steps.summarize.output.text }}"
        }
      }
    }
  ],
  "edges": [
    {
      "from": "fetch",
      "to": "summarize"
    },
    {
      "from": "summarize",
      "to": "store"
    }
  ]
}
